{
  "@context": ["https://www.w3.org/ns/credentials/v2"],
  "id": "https://example.com/credentials/456",
  "type": ["VerifiableCredential", "VerifiablePID"],
  "issuer": "did:ebsi:123",
  "validFrom": "2023-09-01T00:00:00Z",
  "validUntil": "2024-08-31T23:59:59Z",
  "credentialSubject": {
    "id": "did:key:123",
    "familyName": "Dubois",
    "firstName": "Sophie",
    "dateOfBirth": "1985-05-20",
    "personalIdentifier": "987654321",
    "placeOfBirth": {
      "addressCountry": "BE",
      "addressRegion": "BRU",
      "addressLocality": "Brussels"
    },
    "currentAddress": {
      "addressCountry": "BE",
      "addressRegion": "VBR",
      "addressLocality": "Leuven",
      "postalCode": "3000",
      "streetAddress": "456 Elm Ave",
      "fullAddress": "456 Elm Ave, Leuven, VBR 3000, Belgium"
    },
    "gender": "female",
    "nationality": ["BE"]
  },
  "credentialStatus": {
    "id": "https://api.ebsi.eu/csl",
    "type": "DynamicSLBloomFilter2023"
  },
  "credentialSchema": {
    "id": "https://api.ebsi.eu/tsr",
    "type": "JsonSchema"
  }
}
