{
  "@context": ["https://www.w3.org/ns/credentials/v2"],
  "id": "urn:uuid:8568b525-a24e-4bc0-9d97-6a8459ec0130",
  "type": [
    "VerifiableCredential",
    "VerifiableAttestation",
    "VerifiableTrustModel",
    "VerifiableAccreditationToAttest"
  ],
  "issuer": "did:ebsi:zdPj1GPXjfERXxXPE1YTYdJ",
  "validFrom": "2021-11-01T00:00:00Z",
  "validUntil": "2024-06-22T14:11:44Z",
  "credentialSubject": {
    "id": "did:ebsi:zzRmkLPGaFZ9oUrZ6tRF4mk",
    "reservedAttributeId": "111551f6f18c63a10d4b2ca8f41bb16b77f4877630d90b4977d4fed311fc2eaf",
    "permissionFor": [
      {
        "schemaId": "https://api-test.ebsi.eu/trusted-schemas-registry/v3/schemas/zHgbyz9ajVuSProgyMhsiwpcp8g8aVLFRNARm51yyYZp6",
        "types": [
          "VerifiableCredential",
          "VerifiableAttestation",
          "WorkCertificate"
        ],
        "jurisdiction": "https://publications.europa.eu/resource/authority/atu/FIN"
      }
    ]
  },
  "termsOfUse": {
    "type": "AccreditationPolicy",
    "rootAuthorisation": "https://api-test.ebsi.eu/trusted-issuers-registry/v5/issuers/did:ebsi:zvHWX359A3CvfJnCYaAiAde/attributes/60ae46e4fe9adffe0bc83c5e5be825aafe6b5246676398cd1ac36b8999e088a8",
    "parentAccreditation": "https://api-test.ebsi.eu/trusted-issuers-registry/v4/issuers/did:ebsi:zdPj1GPXjfERXxXPE1YTYdJ/attributes/061e750db05d75b024a78f291ae5d4e7d71c71d270384e08d7853f4cbc3b2c75"
  },
  "credentialStatus": {
    "id": "https://api-test.ebsi.eu/trusted-issuers-registry/v4/issuers/did:ebsi:zzRmkLPGaFZ9oUrZ6tRF4mk/attributes/111551f6f18c63a10d4b2ca8f41bb16b77f4877630d90b4977d4fed311fc2eaf",
    "type": "EbsiAccreditationEntry"
  },
  "credentialSchema": {
    "id": "https://api-test.ebsi.eu/trusted-schemas-registry/v3/schemas/zCSHSDwrkkd32eNjQsMCc1h8cnFaxyTXP5ByozyVQXZoH",
    "type": "JsonSchema"
  }
}
