{
  "@context": ["https://www.w3.org/ns/credentials/v2"],
  "id": "urn:uuid:003a1dd8-a5d2-42ef-8182-e921c0a9f2cd",
  "type": ["VerifiableCredential", "VerifiableAttestation", "WorkCertificate"],
  "issuer": {
    "id": "did:ebsi:ziDnioxYYLW1a3qUbqTFz4W",
    "type": "organisation",
    "legalName": "Company ABC",
    "domainName": "https://company.abc"
  },
  "validFrom": "2023-01-01T00:00:00Z",
  "validUntil": "2025-01-01T00:00:00Z",
  "credentialSubject": {
    "id": "did:key:z2dmzD81cgPx8Vki7JbuuMmFYrWPgYoytykUZ3eyqht1j9KbnTvvSLAcNJvfNeLNuB9Y3Mbhus5btx3CBNknmhSStgGbqhMkqfWNSYZ5Vd1A8xQdD948jQSEjShYE1SFe1wZSgsw5S4v6sfHVV2p6waDwh9hCjdWdjFUo3nyU1rYLbuZxg",
    "familyName": "Wonderland",
    "firstName": "Alice",
    "startDate": "2023-01-01T00:00:00Z",
    "endDate": "2024-01-01T00:00:00Z",
    "listOfOccupations": [
      {
        "startDate": "2023-01-01T00:00:00Z",
        "endDate": "2023-06-01T00:00:00Z",
        "occupationalCategory": "15-1252.00"
      },
      {
        "startDate": "2023-06-01T00:00:00Z",
        "endDate": "2024-01-01T00:00:00Z",
        "occupationalCategory": "15-1254.00"
      }
    ]
  },
  "credentialSchema": {
    "type": "JsonSchema",
    "id": "https://link.to.json.schema"
  }
}
